PostContent,Date,NumberOfComment,Like,Heart,Care,Haha,Wow,Sad,Angry,ContentofComment
" CHÍNH THỨC MỞ ĐƠN TUYỂN THÀNH VIÊN DUET - NHÓM TUYỂN SINH, TRUYỀN THÔNG VÀ TỔ CHỨC SỰ KIỆN DUE ",32 phút,2,0,0,0,0,0,0,0,"[' CHÍNH THỨC MỞ ĐƠN TUYỂN THÀNH VIÊN DUET - NHÓM TUYỂN SINH, TRUYỀN THÔNG VÀ TỔ CHỨC SỰ KIỆN DUE ', ' CHÍNH THỨC MỞ ĐƠN TUYỂN THÀNH VIÊN DUET - NHÓM TUYỂN SINH, TRUYỀN THÔNG VÀ TỔ CHỨC SỰ KIỆN DUE \n---------------------\nLink đơn ứng tuyển: https://s.net.vn/DUE… Xem thêm', 'Hóng mãi thôi', 'Apply lẹ để còn gặp tui']"
Cho e hỏi trường mình có trao đổi sv với các trường khác trong nước đúng ko ạ. Thế điều kiện gì để mình được tham gia trao đổi vậy ạ. Và có được chọn trường mình muốn trao đổi ko ạ và có mất thêm chi phí học koo ạ. Em cảm ơn,4 ngày,1,0,0,0,0,0,0,0,"['Cho e hỏi trường mình có trao đổi sv với các trường khác trong nước đúng ko ạ. Thế điều kiện gì để mình được tham gia trao đổi vậy ạ. Và có được chọn trường mình muốn trao đổi ko ạ và có mất thêm chi phí học koo ạ. Em cảm ơn', 'e có thể inb hỏi Phòng Đào tạo nha: https://www.facebook.com/PhongDaoTaoDUE']"
"Nhanh tay apply để tham gia vào hành trình săn lùng những ""chiến mã"" đầy tài năng của Nhà Key nhaa",5 Tháng 10 lúc 20:19,20,0,0,0,0,0,0,0,"['Nhanh tay apply để tham gia vào hành trình săn lùng những ""chiến mã"" đầy tài năng của Nhà Key nhaa', 'CHÍNH THỨC MỞ ĐƠN TUYỂN THÀNH VIÊN CÂU LẠC BỘ K2S\n“DASH TO THE FINISH”\nHãy lướt xuống phần bình luận để biết nhanh tay nhận ""đơn ứng tuyển” và “link frame” nhậ… Xem thêm', 'queo khom queo khommmmmmm', 'Vào\nKết Nối đi nào\nVui lắm á']"
"[TUYỂN THÀNH VIÊN DỰ ÁN GREEN UNIVERSITY DUE - GR:ECO]
PHÁT TÁN TÍN HIỆU - TÌM THẤY “ĐỒNG XANH”
Gieo hạt, bón phân, tưới nước
Nảy mầm, ra rễ, đâm chồi
Tư duy khác đi, tái tạo và phục hồi… Xem thêm",5 Tháng 10 lúc 20:19,3,0,0,0,0,0,0,0,"['[TUYỂN THÀNH VIÊN DỰ ÁN GREEN UNIVERSITY DUE - GR:ECO]\nPHÁT TÁN TÍN HIỆU - TÌM THẤY “ĐỒNG XANH”\nGieo hạt, bón phân, tưới nước\nNảy mầm, ra rễ, đâm chồi\nTư duy khác đi, tái tạo và phục hồi… Xem thêm', 'Các Greeners tương lai của GUD đou gòi ạ']"
"Cho em hỏi đăng kí thi bằng lái xe ở trường thì tổng tất cả chi phí khoảng bao nhiêu ạ. Và em muốn đăng kí thì đến đâu để đăng kí ạ
 em cảm ơnn",5 Tháng 10 lúc 07:07,5,0,0,0,0,0,0,0,"['Cho em hỏi đăng kí thi bằng lái xe ở trường thì tổng tất cả chi phí khoảng bao nhiêu ạ. Và em muốn đăng kí thì đến đâu để đăng kí ạ\n em cảm ơnn', 'Em lên tầng 2 phòng ctsv khu H']"
[Đã có bạn nhận xuất],29 Tháng 9 lúc 15:08,1,0,0,0,0,0,0,0,"['[Đã có bạn nhận xuất]', 'Ib e vs c']"
[SEE CLUB CHÍNH THỨC MỞ ĐƠN TUYỂN THÀNH VIÊN NHIỆM KỲ 2024 - 2025],24 Tháng 9 lúc 17:25,5,0,0,0,0,0,0,0,"['[SEE CLUB CHÍNH THỨC MỞ ĐƠN TUYỂN THÀNH VIÊN NHIỆM KỲ 2024 - 2025]', '[SEE CLUB CHÍNH THỨC MỞ ĐƠN TUYỂN THÀNH VIÊN NHIỆM KỲ 2024 - 2025]', 'Ai mún đăng ký liên hệ mình nha, lấy phí 100k thuiiii', 'Bao lâu mik nhận đc mail ạ?']"
Chỉ còn một ít SLOT cuối cùng nhé các bạn DUERs ơi!!!,27 Tháng 9 lúc 20:19,1,0,0,0,0,0,0,0,"['Chỉ còn một ít SLOT cuối cùng nhé các bạn DUERs ơi!!!', ' [KHAI GIẢNG KHÓA HỌC TIẾNG ANH MẤT GỐC 30/09/2024] ']"
e cần giáo trình các môn này ạ,17 Tháng 9,10,0,0,0,0,0,0,0,"['e cần giáo trình các môn này ạ', 'Mình còn qth và vi mô tiếng anh']"
Mình pass máy casio 580 ah,24 Tháng 9 lúc 18:24,10,0,0,0,0,0,0,0,"['Mình pass máy casio 580 ah', 'Còn k ạ', 'Bn ạ']"
E cần mua giáo trình của các môn này ạ,12 Tháng 9,98,0,0,0,0,0,0,0,"['E cần mua giáo trình của các môn này ạ', 'c có giáo trình marketing tiếng anh em nhé', 'Có 2-3-5-6 ạ']"
E cần mua những sách này ạ,16 Tháng 9,14,0,0,0,0,0,0,0,"['E cần mua những sách này ạ', 'C còn triết nì', 'chị có triết nha, giáo trình+ tlieu ôn tập']"
Tìm người pass ạ,16 Tháng 9,43,0,0,0,0,0,0,0,"['Tìm người pass ạ', 'Bạn này nhanh ác', 'Mình còn triết và E1 (chưa dùng mã)']"
"[ ECO-FUN CLUB | MỞ ĐƠN TUYỂN TÂN THÀNH VIÊN ]
-----------------------------------
 Thời gian mở đơn: 19/09/2024 - 27/09/2024
-----------------------------------
 Link đăng ký:",22 Tháng 9,1,0,0,0,0,0,0,0,"['[ ECO-FUN CLUB | MỞ ĐƠN TUYỂN TÂN THÀNH VIÊN ]\n-----------------------------------\n Thời gian mở đơn: 19/09/2024 - 27/09/2024\n-----------------------------------\n Link đăng ký:', '[ ECO-FUN CLUB | MỞ ĐƠN TUYỂN TÂN THÀNH VIÊN ]\n-----------------------------------\n Thời gian mở đơn: 19/09/2024 - 27/09/2024\n----------------------------------… Xem thêm', 'Đông Kha ly bia']"
help mee @,18 Tháng 9,7,0,0,0,0,0,0,0,['help mee @']
Có ai pass những cuốn này kh ạ,16 Tháng 9,21,0,0,0,0,0,0,0,"['Có ai pass những cuốn này kh ạ', 'mình có nhé', 'C có vi mô mankiw vs lêtg nha']"
ai có pass không ạ,17 Tháng 9,5,0,0,0,0,0,0,0,"['ai có pass không ạ', 'Phạm Lê Thanh Hiền Tui có nltt']"
"Em cần tìm mấy môn bên dưới ạ, anh chị nào còn tài liệu pass cho em nha",16 Tháng 9,14,0,0,0,0,0,0,0,"['Em cần tìm mấy môn bên dưới ạ, anh chị nào còn tài liệu pass cho em nha', 'Mình có sách t.anh đã cào mã', 'C có vi mô mankiw vs lêtg nha']"
"[ TUYỂN THÀNH VIÊN FALL MELODY ]
-----------------------
 Form đăng ký: https://bit.ly/Formdangkytuyenthanhvien
 Booklet: https://bit.ly/SoTayThongTinTTV
  Đố… Xem thêm",18 Tháng 9,13,0,0,0,0,0,0,0,"['[ TUYỂN THÀNH VIÊN FALL MELODY ]\n-----------------------\n Form đăng ký: https://bit.ly/Formdangkytuyenthanhvien\n Booklet: https://bit.ly/SoTayThongTinTTV\n  Đố… Xem thêm', 'Lê Thùy Trang zô để đi cụng ly', 'Điền đơn ngay thui']"
Anh chị nào pass các môn này hong ạ ,17 Tháng 9,8,0,0,0,0,0,0,0,"['Anh chị nào pass các môn này hong ạ ', 'Mình có pldc vs marketing', 'còn cần thì ib mình nhé']"
Tìm mua những môn này ạ,17 Tháng 9,5,0,0,0,0,0,0,0,"['Tìm mua những môn này ạ', 'C có sách TA EE1 đã cào mã', 'Chị cs nè e']"
Em cần sách mấy môn này ạ,17 Tháng 9,3,0,0,0,0,0,0,0,"['Em cần sách mấy môn này ạ', 'C có vi mô nha', 'Còn toán nghe']"
Dạ em cần mua giáo trình và slide của các môn này ạ.Em cảm ơn,16 Tháng 9,12,0,0,0,0,0,0,0,"['Dạ em cần mua giáo trình và slide của các môn này ạ.Em cảm ơn', 'Ib chị nha', 'Mk có mar, pldc, vi mô']"
Em cần mua những giáo trình này ạ,16 Tháng 9,4,0,0,0,0,0,0,0,"['Em cần mua những giáo trình này ạ', 'Còn vi mô vs qtr', 'Mk có vi mô vs E1 đã cào mã']"
Cho em hỏi có anh/chị nào pass tài liệu những môn này ko ạ?,8 Tháng 9,23,0,0,0,0,0,0,0,"['Cho em hỏi có anh/chị nào pass tài liệu những môn này ko ạ?', 'Mình có plđc, toán vs tin nhe']"
"Em chào mn ạ. Các anh chị trong BCH Đoàn Trường cho em hỏi một vài câu được kh ạ
(Ảnh 1): Anh chị cho em hỏi là điểm thi THPTQG 2024 là điểm tổng của 6 môn thi hay là điểm tổ hợp 3 môn dùng để xét tuyển thôi ạ?
(Ảnh 2): Anh chị cho em hỏi các hoạt động trong và ngoài trường đã tham gia là trường THPT hay là trường đại học ạ? 
Mong nhận được phản hồi, em cảm ơn",17 Tháng 9,2,0,0,0,0,0,0,0,"['Em chào mn ạ. Các anh chị trong BCH Đoàn Trường cho em hỏi một vài câu được kh ạ\n(Ảnh 1): Anh chị cho em hỏi là điểm thi THPTQG 2024 là điểm tổng của 6 môn thi hay là điểm tổ hợp 3 môn dùng để xét tuyển thôi ạ?\n(Ảnh 2): Anh chị cho em hỏi các hoạt động trong và ngoài trường đã tham gia là trường THPT hay là trường đại học ạ? \nMong nhận được phản hồi, em cảm ơn', 'Chào em, chị xin phép trả lời câu hỏi của em nha:\nCâu 1: Mình sẽ điền điểm thi tổ hợp 3 môn mà em dùng để xét tuyển\nCâu 2: Các hoạt động trong và ngoài trường THPT hoặc Đại học đều được nè… Xem thêm']"
Em cần tìm người pass giáo trình các môn dưới đây ạ,11 Tháng 9,29,0,0,0,0,0,0,0,"['Em cần tìm người pass giáo trình các môn dưới đây ạ', 'chị có trừ marketing', 'Có mkt nè']"
Em cần tìm mua ạ,12 Tháng 9,11,0,0,0,0,0,0,0,"['Em cần tìm mua ạ', 'mình có giáo trình vi mô nha bạn', 'QTH th Phương ib nha']"
Có anh chị nào còn pass những sách này ko ạ,14 Tháng 9,14,0,0,0,0,0,0,0,"['Có anh chị nào còn pass những sách này ko ạ', 'C có gtrinh vĩ mô', 'slide vi mô, gt mar+slide']"
e cần những giáo trình này ạ. ac có pass lại giúp e với.,10 Tháng 9,34,0,0,0,0,0,0,0,"['e cần những giáo trình này ạ. ac có pass lại giúp e với.', 'Mình có qth thầy phương nha', 'Chị gửi nha']"
Cs ai pass cuốn này k ạ,16 Tháng 9,4,0,0,0,0,0,0,0,"['Cs ai pass cuốn này k ạ', 'Có nha', 'Up']"
em cần tìm những tài liệu môn này ạ.,15 Tháng 9,11,0,0,0,0,0,0,0,"['em cần tìm những tài liệu môn này ạ.', 'Chị có t.anh chưa cào mã', 'C có vĩ mô và triết nha']"
"e cần pass sách các môn như hình với ạ, trừ PLDC",13 Tháng 9,18,0,0,0,0,0,0,0,"['e cần pass sách các môn như hình với ạ, trừ PLDC', 'c có marketing giáo trình slide + file ôn tập nhé', 'C có giáo trình marketing và sách life A1-A2 em nhé']"
Em cần mua giáo trình tài liệu các môn này ạ,12 Tháng 9,23,0,0,0,0,0,0,0,"['Em cần mua giáo trình tài liệu các môn này ạ', 'mình có qth nha', 'Còn plđc với toán nha']"
"Anh chị ơi còn các sách này không ạ, pass lại em với ạ",13 Tháng 9,11,0,0,0,0,0,0,0,"['Anh chị ơi còn các sách này không ạ, pass lại em với ạ', 'mình có full nhé', 'Mình có vi mô và qthoc']"
"em tìm tài liệu các môn này ạ, ai có pass em với ạ",13 Tháng 9,14,0,0,0,0,0,0,0,"['em tìm tài liệu các môn này ạ, ai có pass em với ạ', 'Mình có tin nha', 'Mk có A1-A2 đã cào mã']"
Em cần giáo trình có bài tập càng tốt ạ ,14 Tháng 9,3,0,0,0,0,0,0,0,"['Em cần giáo trình có bài tập càng tốt ạ ', 'Mình có slide CSLT, sách life A1-A2 đã cào mã (tặng file đáp án và đề ôn)']"
"Cần tìm mua những giáo trình này ạ, anh chị nào có pass lại cho em với",13 Tháng 9,16,0,0,0,0,0,0,0,"['Cần tìm mua những giáo trình này ạ, anh chị nào có pass lại cho em với', 'không em nhé', 'Mình có PL ĐC']"
Có anh chị nào pass lại slide kinh tế vĩ mô của cô Đặng Thị Hồng Dân và slide tin học ứng dụng của cô Hoàng Thị Thanh Hà kh ạ?,14 Tháng 9,2,0,0,0,0,0,0,0,"['Có anh chị nào pass lại slide kinh tế vĩ mô của cô Đặng Thị Hồng Dân và slide tin học ứng dụng của cô Hoàng Thị Thanh Hà kh ạ?', 'anh có nè em']"
"Anh chị ơi, cho em hỏi là mình có cần mua sách các môn trước khi đến lớp (vào tuần sau) không ạ? Em là svien khoá 50K ạ",7 Tháng 9,6,0,0,0,0,0,0,0,"['Anh chị ơi, cho em hỏi là mình có cần mua sách các môn trước khi đến lớp (vào tuần sau) không ạ? Em là svien khoá 50K ạ', 'Mình cần pass 1 số tlieu này nha']"
"em cần tìm gtrinh và slide 
@kinh tế vi mô thầy Nguyễn Thành Long
Pháp luật đaị cương cô Nguyễn Phương Trang
kinh tế vĩ mô thầy Nguyễn Danh Khôi",14 Tháng 9,1,0,0,0,0,0,0,0,"['em cần tìm gtrinh và slide \n@kinh tế vi mô thầy Nguyễn Thành Long\nPháp luật đaị cương cô Nguyễn Phương Trang\nkinh tế vĩ mô thầy Nguyễn Danh Khôi', 'mình có kt vi mô, vĩ mô nhé']"
Em cần sách của những môn này ạ,12 Tháng 9,29,0,0,0,0,0,0,0,"['Em cần sách của những môn này ạ', 'Chị có mar căn bản, toán và plđc nah', 'C có vi mô nha']"
em cần tìm giáo trình và tài liệu các môn này ạ ,12 Tháng 9,16,0,0,0,0,0,0,0,"['em cần tìm giáo trình và tài liệu các môn này ạ ', 'Chị còn', 'Mình còn vi mô nha']"
"Dạ em muốn tìm những tài liệu dưới đây ạa, anh chị nào có cho em xin/pass lại cho em với nhaa",14 Tháng 9,7,0,0,0,0,0,0,0,"['Dạ em muốn tìm những tài liệu dưới đây ạa, anh chị nào có cho em xin/pass lại cho em với nhaa', 'C có vi mô LTG nha', 'Mình có toán cao cấp']"
"Anh chị nào có pass cho e vs ạ
Giáo trình, slide 
Kinh tế vi mô
Kinh tế vĩ mô
Marketing căn bản
Q… Xem thêm",10 Tháng 9,30,0,0,0,0,0,0,0,"['Anh chị nào có pass cho e vs ạ\nGiáo trình, slide \nKinh tế vi mô\nKinh tế vĩ mô\nMarketing căn bản\nQ… Xem thêm', 'Mình có giáo trình vi mô + file ôn tập nha', 'Mik có gtr qth vs plđc']"
Có ac nào pass tài liệu những môn này ko ạ?,10 Tháng 9,24,0,0,0,0,0,0,0,"['Có ac nào pass tài liệu những môn này ko ạ?', 'Mình có full nha', 'Mình có vi mô ạ']"
"Cho mình hỏi là sáng hôm t5 tiết 4,5 có học Lịch sử Đảng không ạ, sáng t5 mình vô check mà không để ý tới tối mới biết có lịch học mà mình không đi. Có ai học cho mình biết là có điểm danh không với cần giáo trình gì ạ. Mình cảm ơn",13 Tháng 9,3,0,0,0,0,0,0,0,"['Cho mình hỏi là sáng hôm t5 tiết 4,5 có học Lịch sử Đảng không ạ, sáng t5 mình vô check mà không để ý tới tối mới biết có lịch học mà mình không đi. Có ai học cho mình biết là có điểm danh không với cần giáo trình gì ạ. Mình cảm ơn', 'tui cũng giống b nề', 'Mình có gt lsđ']"
"Mình có các môn sau ạ, ai cần mua ib",8 Tháng 9,2,0,0,0,0,0,0,0,"['Mình có các môn sau ạ, ai cần mua ib', 'Còn plđc k ạ']"
"Các ac lớp 50K??.1 pass sách,tài liệu những môn của các gv như hình ko ạ?",10 Tháng 9,15,0,0,0,0,0,0,0,"['Các ac lớp 50K??.1 pass sách,tài liệu những môn của các gv như hình ko ạ?', 'Cần pass ạ', 'Mình có mkt, plđc']"
em tìm tài liệu môn này ạ,12 Tháng 9,29,0,0,0,0,0,0,0,"['em tìm tài liệu môn này ạ', 'c có sách ch cào mã nha', 'Cs sách đã cào mã 20k']"
"Anh chị cho em hỏi Đội Tiền Phong còn mở tuyển thành viên không ạ ?
Em muốn tìm hiểu thêm về Đội Tiền phong nhưng chưa biết tìm ở đâu, anh chị nào ở trong đội có thể cho em ib để hỏi luôn đc k ạ 
Em cảm ơn anh chị rất nhiềuu",12 Tháng 9,9,0,0,0,0,0,0,0,"['Anh chị cho em hỏi Đội Tiền Phong còn mở tuyển thành viên không ạ ?\nEm muốn tìm hiểu thêm về Đội Tiền phong nhưng chưa biết tìm ở đâu, anh chị nào ở trong đội có thể cho em ib để hỏi luôn đc k ạ \nEm cảm ơn anh chị rất nhiềuu', 'em liên hệ anh nha']"
Em thấy có một số clb đã bắt đầu mở form đăng kí và có clb đã đóng đơn đăng kí. Thì có thể cho em hỏi là clb chỉ mở tuyển đơn 1 lần trong 1 năm hay sao ạ. Và nếu apply vào clb thì clb nào cũng phải phỏng vấn hay chỉ cần điền form là được ạ. Em cảm ơn.,3 Tháng 9,16,0,0,0,0,0,0,0,"['Em thấy có một số clb đã bắt đầu mở form đăng kí và có clb đã đóng đơn đăng kí. Thì có thể cho em hỏi là clb chỉ mở tuyển đơn 1 lần trong 1 năm hay sao ạ. Và nếu apply vào clb thì clb nào cũng phải phỏng vấn hay chỉ cần điền form là được ạ. Em cảm ơn.', 'Thường thì 1 năm tuyển 1 lần á em. VD CLB Guitar của c sẽ tuyển 1 lần là thành viên CLB, 1 lần là thành viên ban điều hành (chuyên tổ chức sự kiện). Tuyển tv CLB thì chỉ cần điền form, còn tuyển BĐH thì phải phỏng vấn hoặc casting nếu như vào ban nhạc nha', 'hi bạn nha, Đội Tiền Phong luôn mở cửa đón chào thành viên, bạn chỉ cần quét mã, tgia hoạt động của Đội là đã trở thành thành viên của Đội Tiền Phong rùi. Hiện tại nhà Xanh có rất nhiều hoạt động lớn nhỏ khác nhau như Gây quỹ Trung thu, Trung thu Nhỏ,…… Xem thêm']"
Trường mình có vụ đăng kí học trao đổi due qua tmu ở hà nội không ạ =)),18 Tháng 8,6,0,0,0,0,0,0,0,"['Trường mình có vụ đăng kí học trao đổi due qua tmu ở hà nội không ạ =))', 'Đây là chương trình trao đổi sv giữa 10 trường đh, e muốn học trao đổi ở trường nào thì theo dõi thông báo trao đổi của trường đó nha', 'Sinh viên 10 trường Đại học khối Kinh tế (ĐH Kinh tế Quốc dân, ĐH Kinh tế TP. Hồ Chí Minh, ĐH Ngoại thương, ĐH Thương mại, Học viện Ngân hàng, Học viện Tài chính, Học viện Chính sách & Phát triển, ĐH Kinh tế – ĐH Huế, ĐH Kinh… Xem thêm']"
E cần tài liệu những môn này ạ. Có ac nào pass ko ạ,10 Tháng 9,18,0,0,0,0,0,0,0,"['E cần tài liệu những môn này ạ. Có ac nào pass ko ạ', 'mình có Mar+QTH', 'qth 15k nha']"
Em cần tìm ng pass những sách này ạ,8 Tháng 9,61,0,0,0,0,0,0,0,"['Em cần tìm ng pass những sách này ạ', 'Minh Khánh giống tkb của mình nè. Chắc cùng chuyên ngành rồi', 'Mình có hết ạ']"
Thẻ từ là mình tự đki làm sau khi có mssv hay trường sẽ cấp cho mình ạ,2 Tháng 9,5,0,0,0,0,0,0,0,"['Thẻ từ là mình tự đki làm sau khi có mssv hay trường sẽ cấp cho mình ạ', 'Em tự đăng ký thẻ từ nha']"
A/c ơi e muốn hỏi về phương thức xét tuyển sớm bằng năng lực ngoại ngữ ở trường mình. Điểm chuẩn bên trái là so với điểm quy đổi đúng không ạ? Em cảm ơn ạ,11 Tháng 9,1,0,0,0,0,0,0,0,['A/c ơi e muốn hỏi về phương thức xét tuyển sớm bằng năng lực ngoại ngữ ở trường mình. Điểm chuẩn bên trái là so với điểm quy đổi đúng không ạ? Em cảm ơn ạ']
"em cần hỏi một số thông tin sau, em cảm ơn ạ 
1.  về đầu ra chứng chỉ ngoại ngữ, em xét tuyển bằng ielts, vậy trong thời gian tới em có cần học toeic ko vì em thấy mấy ac bảo học toeic để lấy đầu ra ạ. ielts của em còn hạn tới 2026 thì có thể nộp để xét đầu ra được ko (nếu có thì bằng cách nào ạ)?",11 Tháng 9,1,0,0,0,0,0,0,0,"['em cần hỏi một số thông tin sau, em cảm ơn ạ \n1.  về đầu ra chứng chỉ ngoại ngữ, em xét tuyển bằng ielts, vậy trong thời gian tới em có cần học toeic ko vì em thấy mấy ac bảo học toeic để lấy đầu ra ạ. ielts của em còn hạn tới 2026 thì có thể nộp để xét đầu ra được ko (nếu có thì bằng cách nào ạ)?', 'Câu 1 và 2 e liên hệ Phòng Đào tạo, Trường Đại học Kinh tế - Đại học Đà Nẵng hỏi nha, hoặc gọi 02363 950110']"
em muốn huỷ học phần tiếng anh vì em đang học ielts để xét đầu ra ạ. Vậy hôm nay hết hạn 16h00 ngày 11/09/2024 mà trúng mấy ngày gvcn em không có để xin chữ kí xác nhận không biết em nộp trễ 1 ngày được không ạ. Em cảm ơn ạ ,11 Tháng 9,1,0,0,0,0,0,0,0,"['em muốn huỷ học phần tiếng anh vì em đang học ielts để xét đầu ra ạ. Vậy hôm nay hết hạn 16h00 ngày 11/09/2024 mà trúng mấy ngày gvcn em không có để xin chữ kí xác nhận không biết em nộp trễ 1 ngày được không ạ. Em cảm ơn ạ ', 'E liên hệ Phòng Đào tạo, Trường Đại học Kinh tế - Đại học Đà Nẵng hoặc gọi 02363 950110 hỏi nhé']"
"dạ em muốn hỏi nếu huỷ học phần tiếng anh thì em cần nộp chứng chỉ tiếng anh từ bậc 3, vậy nếu em học toeic để nộp chứng chỉ thì em học 2 hay 4 kỹ năng vậy ạ. Em cảm ơn, em là sinh viên khoá 50K ạ",11 Tháng 9,5,0,0,0,0,0,0,0,"['dạ em muốn hỏi nếu huỷ học phần tiếng anh thì em cần nộp chứng chỉ tiếng anh từ bậc 3, vậy nếu em học toeic để nộp chứng chỉ thì em học 2 hay 4 kỹ năng vậy ạ. Em cảm ơn, em là sinh viên khoá 50K ạ', '2 nha', 'E liên hệ Phòng Đào tạo, Trường Đại học Kinh tế - Đại học Đà Nẵng để đc tư vấn nha, hoặc gọi 02363 950110 h hành chính']"
Em cần mua tl những môn này ạ,8 Tháng 9,26,0,0,0,0,0,0,0,"['Em cần mua tl những môn này ạ', 'Chị có pass nha', 'full']"
"ac ơi cho em hỏi là: tadv em được 141 xếp vào lớp b1, có thể hủy học phần để tự học bên ngoài thì em điền đơn này đúng không ạ với tên học phần là gì ạ. em xin cảm ơn",10 Tháng 9,20,0,0,0,0,0,0,0,"['ac ơi cho em hỏi là: tadv em được 141 xếp vào lớp b1, có thể hủy học phần để tự học bên ngoài thì em điền đơn này đúng không ạ với tên học phần là gì ạ. em xin cảm ơn', 'Tên học phần là ""English communication 1"" và số tín chỉ là 3 nha', 'cho e hỏi có ielts thì đc pass như nào ạ']"
"[EMAIL CHO TÂN SINH VIÊN 50K]
========
Nhà trường đã tạo email Trường cho tất cả các em (theo format: Mã Sinh viên@due.udn.vn) ",10 Tháng 9,2,0,0,0,0,0,0,0,['[EMAIL CHO TÂN SINH VIÊN 50K]\n========\nNhà trường đã tạo email Trường cho tất cả các em (theo format: Mã Sinh viên@due.udn.vn) ']
"dạ em cần giáo trình và slide những môn này ạ, có anh chị nào pass không ạ",10 Tháng 9,12,0,0,0,0,0,0,0,"['dạ em cần giáo trình và slide những môn này ạ, có anh chị nào pass không ạ', 'Mình có vi mô, plđc nhe', 'mình có toán nhaa']"
Các anh/chị cho em hỏi là xin giấy xác nhận nhập học/giấy xác nhận là SV của trường để nộp cho địa phương là xin ở đâu vậy ạ,10 Tháng 9,2,0,0,0,0,0,0,0,"['Các anh/chị cho em hỏi là xin giấy xác nhận nhập học/giấy xác nhận là SV của trường để nộp cho địa phương là xin ở đâu vậy ạ', 'e vô đây đk nha: https://due.udn.vn/.../phongctsvchitiet/id/10816/cid/536']"
"Mình cần pass các tài liệu sau : 
- kinh tế vi mô : giáo trình + slide + bài tập + đề ôn tập + đề thi các năm : 25k
- Kinh tế vĩ mô : giáo trình + slide + file đề ôn thi + đề thi các năm : 25k
- Pháp luật đại cương : giáo trình + slide + bài tập ôn thi : 20k
- Toán ứng dụng trong kinh tế : giáo trình + slide + bài tập + đề thi các năm : 20k … Xem thêm",8 Tháng 9,13,0,0,0,0,0,0,0,"['Mình cần pass các tài liệu sau : \n- kinh tế vi mô : giáo trình + slide + bài tập + đề ôn tập + đề thi các năm : 25k\n- Kinh tế vĩ mô : giáo trình + slide + file đề ôn thi + đề thi các năm : 25k\n- Pháp luật đại cương : giáo trình + slide + bài tập ôn thi : 20k\n- Toán ứng dụng trong kinh tế : giáo trình + slide + bài tập + đề thi các năm : 20k … Xem thêm', 'Mỹ Tiên cần ko', 'rep ib em vs ạ']"
"Em thuộc lớp English Elementary 1 ạ
Cho em hỏi là em bắt buộc học Tiếng Anh tại trường hay có được tự học rồi nộp chứng chi cho trường không ạ ??",9 Tháng 9,9,0,0,0,0,0,0,0,"['Em thuộc lớp English Elementary 1 ạ\nCho em hỏi là em bắt buộc học Tiếng Anh tại trường hay có được tự học rồi nộp chứng chi cho trường không ạ ??', 'E xem tbao ở đây nhé:\nChi tiết thông báo vui lòng xem tại: https://due.udn.vn/.../thongbaochitiet/id/19485/bid/456', 'xem ds xếp lớp này ở đâu v bạn']"
Cho em hỏi là e có cần phải nộp CCTA để miễn học phần Tiếng anh nữa không khi đã miễn thi TADV rồi ạ. Nếu phải nộp thì nộp ở phòng nào ạ? Em cảm ơn ạ.,9 Tháng 9,1,0,0,0,0,0,0,0,"['Cho em hỏi là e có cần phải nộp CCTA để miễn học phần Tiếng anh nữa không khi đã miễn thi TADV rồi ạ. Nếu phải nộp thì nộp ở phòng nào ạ? Em cảm ơn ạ.', 'E đã đk miễn avdv ở kê khai nhập học là miễn các hp TA rồi e']"
"dạ anh/chị cho em hỏi, em thi tadv được 145 điểm và thấy mọi người trên nhóm nói là có thể tự làm đơn huỷ lớp communication 1. Vậy cho em hỏi mình lấy mẫu đơn ở đâu vậy ạ? em cảm ơn ạ!",9 Tháng 9,1,0,0,0,0,0,0,0,"['dạ anh/chị cho em hỏi, em thi tadv được 145 điểm và thấy mọi người trên nhóm nói là có thể tự làm đơn huỷ lớp communication 1. Vậy cho em hỏi mình lấy mẫu đơn ở đâu vậy ạ? em cảm ơn ạ!', 'Chi tiết thông báo vui lòng xem tại: https://due.udn.vn/.../thongbaochitiet/id/19485/bid/456']"
