PostContent,Date,NumberOfComment,Like,Heart,Care,Haha,Wow,Sad,Angry,ContentofComment
"Dạ các anh chị cho em hỏi một số câu hỏi ạ
1. Tiền học phí tạm đóng đã bao gồm các khoản: tiền khám sức khỏe, BHYT... chưa ạ
2. Em thấy trường liên kết với ngân hàng Đông Á, thì mình phải làm một tknh Đông Á rồi chuyển học phí qua đó hay ngân hàng nào cũng được ạ
3. Em thấy trường có yêu cầu bản photo của BHYT nhưng mà hồi giáo viên em bảo là BHYT của em cập nhật trên hệ thống rồi nên không có bản giấy, thì bây giờ phải làm sao ạ
4. Thi TAĐV phải đạt từ bao nhiêu điểm trở lên… Xem thêm",18 Tháng 8,14,0,0,0,0,0,0,0,"['Dạ các anh chị cho em hỏi một số câu hỏi ạ\n1. Tiền học phí tạm đóng đã bao gồm các khoản: tiền khám sức khỏe, BHYT... chưa ạ\n2. Em thấy trường liên kết với ngân hàng Đông Á, thì mình phải làm một tknh Đông Á rồi chuyển học phí qua đó hay ngân hàng nào cũng được ạ\n3. Em thấy trường có yêu cầu bản photo của BHYT nhưng mà hồi giáo viên em bảo là BHYT của em cập nhật trên hệ thống rồi nên không có bản giấy, thì bây giờ phải làm sao ạ\n4. Thi TAĐV phải đạt từ bao nhiêu điểm trở lên… Xem thêm', '2. Khi em có thẻ sinh viên thì đó cũng là thẻ ngân hàng Đông Á luôn nhé, khi nộp học phí thì em chỉ cần chuyển tiền qua ngân hàng Đông Á là được nha. Còn tsv thì nộp học phí qua stk của trường em nha.\n4. Thi tiếng anh đầu vào, em thi từ 120-139đ thì sẽ… Xem thêm', 'Đây e nha']"
"Cho em hỏi Học bạ THPT, bằng cntn là phải có bản chính và 1 bản photo công chứng hay 1 trong 2 vậy ạ",17 Tháng 8,9,0,0,0,0,0,0,0,"['Cho em hỏi Học bạ THPT, bằng cntn là phải có bản chính và 1 bản photo công chứng hay 1 trong 2 vậy ạ', 'Cho mình hỏi xem danh sách hồ sơ có nhưnzg gì ở đâu vậy ạ', 'Cái nào ghi cả 2 lả nộp hả cả 2 đó e']"
"Mn có thể review cho em hai chuyên ngành của Marketing là Truyền Thông và Digital như thế nào được hong ạ? Em có đọc qua chương trình học của 2 cái rồi và cảm thấy okela với cả 2 nên em đang phân vân. Mn giúp em với, em xin cảm ơnnn",18 Tháng 8,3,0,0,0,0,0,0,0,"['Mn có thể review cho em hai chuyên ngành của Marketing là Truyền Thông và Digital như thế nào được hong ạ? Em có đọc qua chương trình học của 2 cái rồi và cảm thấy okela với cả 2 nên em đang phân vân. Mn giúp em với, em xin cảm ơnnn', 'Mn giúp em với ạa', '.']"
mn ơi cho em hỏi là nếu xts bằng giải hsg tỉnh thì khi đc học bổng thì sẽ trừ vào tiền học phí 1 kì ạ,17 Tháng 8,2,0,0,0,0,0,0,0,"['mn ơi cho em hỏi là nếu xts bằng giải hsg tỉnh thì khi đc học bổng thì sẽ trừ vào tiền học phí 1 kì ạ', 'Với các khoản học bổng thì khi sinh viên hoàn thành các khoản học phí, tiền học bổng sẽ được chuyển về tài khoản ngân hàng của sinh viên em nhé.']"
Dạ ac cho em hỏi: Tuần sinh hoạt công dân đầu khóa kéo dài bao nhiêu ngày vậy ạ? Nếu như vắng thì có sao không ạ?,17 Tháng 8,4,0,0,0,0,0,0,0,"['Dạ ac cho em hỏi: Tuần sinh hoạt công dân đầu khóa kéo dài bao nhiêu ngày vậy ạ? Nếu như vắng thì có sao không ạ?', 'Vắng sẽ bị trừ điểm rèn luyện và bắt buộc học lại nha e', 'Vắng sẽ bị trừ điểm rèn luyện nhaaa']"
Anh chị ơi sơ yếu lí lịch của trường có cần xin dấu tại xã không ạ. Chứ em 20 vào Đà Nẵng sợ không xin được ạ ,17 Tháng 8,3,0,0,0,0,0,0,0,"['Anh chị ơi sơ yếu lí lịch của trường có cần xin dấu tại xã không ạ. Chứ em 20 vào Đà Nẵng sợ không xin được ạ ', 'K cần sơ yếu lí lịch á em. Em làm theo hướng dẫn đã đăng ở fanpage và web trường nhé', 'Ké với ạ']"
Giấy xác minh thông tin về nơi cư trú này mình xin ở đâu ạ,17 Tháng 8,4,0,0,0,0,0,0,0,"['Giấy xác minh thông tin về nơi cư trú này mình xin ở đâu ạ', 'Xin ở Phường/Xã em nhé', 'Em tải form trên gg xong điền thông tin or ra phường/xã e nha, rcm tải nha e. Sau đó đem cho phường/xã kí.']"
"Cho em hỏi cái này là mình tự cộng các khoản 1, 2, 3 vào hay mức học phí tạm thu đã bao gồm hết rồi ạ? Tiện thể cho em xin gr ngành KDQT với ạ.",17 Tháng 8,1,0,0,0,0,0,0,0,"['Cho em hỏi cái này là mình tự cộng các khoản 1, 2, 3 vào hay mức học phí tạm thu đã bao gồm hết rồi ạ? Tiện thể cho em xin gr ngành KDQT với ạ.', 'Mức phí tạm thu đã tính cả 3 khoản rồi em nha']"
"Cho e hỏi học phí tạm thu này là sao ạ, nó sẽ chênh lệch tầm bao nhiêu so với học phí chính thức ạ",17 Tháng 8,6,0,0,0,0,0,0,0,"['Cho e hỏi học phí tạm thu này là sao ạ, nó sẽ chênh lệch tầm bao nhiêu so với học phí chính thức ạ', 'bn ơi coi ở đâu v ạ', 'Cho em hỏi đã có danh sách học bổng chưa ạ? Nếu sinh viên đạt học bổng thì nhà trường sẽ thanh toán lại học phí tạm thu hay sao ạ? Em cảm ơn anh/chị ạ.']"
"cho em hỏi là em vừa nộp chứng chỉ để miễn học phần tiếng anh, vừa nộp theo phương thức tuyển sinh riêng thì là thành 2 bản photo công chứng hay sao ạ",17 Tháng 8,2,0,0,0,0,0,0,0,"['cho em hỏi là em vừa nộp chứng chỉ để miễn học phần tiếng anh, vừa nộp theo phương thức tuyển sinh riêng thì là thành 2 bản photo công chứng hay sao ạ', 'Đúng rồi em nhé.']"
"- Mg cho em xin flie phíu lí lịch & giấy xác nhận thông tin cư trú mẫu với ạ.
- Dạ em xin hỏi là thẻ sinh viên là mình tự in 2 giấy trường có nói pk ạ, mà em có thấy 1 flie mế ạ dạ  mg thồn rin em biết với ạ",17 Tháng 8,4,0,0,0,0,0,0,0,"['- Mg cho em xin flie phíu lí lịch & giấy xác nhận thông tin cư trú mẫu với ạ.\n- Dạ em xin hỏi là thẻ sinh viên là mình tự in 2 giấy trường có nói pk ạ, mà em có thấy 1 flie mế ạ dạ  mg thồn rin em biết với ạ', '3/ Giấy làm thẻ SV, em in 4 tờ, điền thông tin theo hướng dẫn và chờ thông báo nộp nhé.', '1/ Phiếu lý lịch và xác nhận nhập học: Sẽ in tự động trong Cổng nhập học của Trường sau khi em hoàn thiện thông tin nhập học.']"
a/c cho em hỏi giấy chứng nhận nvqs và giấy giới thiệu di chuyển nvqs mình lấy ở đâu v ạ,17 Tháng 8,1,0,0,0,0,0,0,0,"['a/c cho em hỏi giấy chứng nhận nvqs và giấy giới thiệu di chuyển nvqs mình lấy ở đâu v ạ', 'Em xin tại BCH QS xã, phường á']"
"hong biết là có gr riêng của quản trị nhân lực hong ạ, tại em tìm hoài mà thấy toàn qtkd í ạ . Mặc dù biết là qtnl thuộc qtkd nhma vẫn muốnn tìm 1 gr riêng cho ngành qtnl í ạaa.",14 Tháng 8,3,0,0,0,0,0,0,0,"['hong biết là có gr riêng của quản trị nhân lực hong ạ, tại em tìm hoài mà thấy toàn qtkd í ạ . Mặc dù biết là qtnl thuộc qtkd nhma vẫn muốnn tìm 1 gr riêng cho ngành qtnl í ạaa.', 'Link gr đây e nha\nChuyên ngành Quản trị nguồn nhân lực (K17): https://zalo.me/g/znqxhs148', 'Các bạn tân sinh viên vẫn đang còn loay hoay,chưa biết ôn luyện TA đầu vào ntn thì chủ động ib chị gửi tài liệu miễn phí nhé.']"
"Cho e hỏi, hiện tại e trật những nv 1 2 3 thì e để nv của trường mình nv 4 ( e đã đỗ xts) thì e vẫn đỗ đúng k ạ",17 Tháng 8,2,0,0,0,0,0,0,0,"['Cho e hỏi, hiện tại e trật những nv 1 2 3 thì e để nv của trường mình nv 4 ( e đã đỗ xts) thì e vẫn đỗ đúng k ạ', 'Nhờ ac cho e câu trả lời vs ạ\nE lo quá']"
"mnguoi ơi, trường mình có nhóm luật kinh tế k ạ, e tìm mãi mà k vào nhóm được ạ",15 Tháng 8,9,0,0,0,0,0,0,0,"['mnguoi ơi, trường mình có nhóm luật kinh tế k ạ, e tìm mãi mà k vào nhóm được ạ', 'Nhóm mess đây em nhé', 'Có nhóm khoa kinh tế k ạ']"
 ĐIỂM CHUẨN TRƯỜNG ĐẠI HỌC KINH TẾ - ĐẠI HỌC ĐÀ NẴNG NĂM 2024 ,17 Tháng 8,3,0,0,0,0,0,0,0,"[' ĐIỂM CHUẨN TRƯỜNG ĐẠI HỌC KINH TẾ - ĐẠI HỌC ĐÀ NẴNG NĂM 2024 ', 'Quá đỉnh Thục Nguyễn']"
mọi người cho em hỏi là tuần sinh hoạt đầu khoá mình xin nghỉ 1ngày có ảnh hưởng gì nhiều không ạ,16 Tháng 8,4,0,0,0,0,0,0,0,"['mọi người cho em hỏi là tuần sinh hoạt đầu khoá mình xin nghỉ 1ngày có ảnh hưởng gì nhiều không ạ', 'Mỗi buổi sẽ có điểm danh và sẽ là căn cứ để xét điểm rèn luyện nhé em', 'hạn chế nghỉ sinh hoạt đầu khoá vì nó sẽ ảnh hưởng đến điểm rè luyện đó bạn nha']"
Phiếu lí lịch này điền on xong in ra dán ảnh vào hay phải mua hồ sơ như hình bên ạ.,14 Tháng 8,3,0,0,0,0,0,0,0,"['Phiếu lí lịch này điền on xong in ra dán ảnh vào hay phải mua hồ sơ như hình bên ạ.', 'Cái đầu thôi á em, khi nhập học thì mang theo các giấy tờ đã yêu cầu tới nộp là đc á']"
"dạ e có 1 số thắc mắc  về ktx trường mình ạ, ai ở ktx trường mình cho e hỏi với ạ",15 Tháng 8,2,0,0,0,0,0,0,0,"['dạ e có 1 số thắc mắc  về ktx trường mình ạ, ai ở ktx trường mình cho e hỏi với ạ', 'ib']"
Dạo này mình thấy vấn đề học phí năm nay đang được quan tâm khá nhiều. Nhưng mà mình không biết xem học phí ở đâu cả. Mng chỉ giúp mình với!!,15 Tháng 8,4,0,0,0,0,0,0,0,"['Dạo này mình thấy vấn đề học phí năm nay đang được quan tâm khá nhiều. Nhưng mà mình không biết xem học phí ở đâu cả. Mng chỉ giúp mình với!!', 'Em tra thông báo của phòng kế hoạch tài chính em nhé', 'E xem học phí ở đây nhé:\nhttps://due.udn.vn/vi-vn/tuvantuyensinh2024/gt/cid/5417']"
"mọi người ơi vay sinh viên có giới hạn độ tuổi không ạ? em học muộn 2 năm, 2k2 giờ sắp lên năm 3, em muốn vay sinh viên thì có được không ạ?",15 Tháng 8,1,0,0,0,0,0,0,0,"['mọi người ơi vay sinh viên có giới hạn độ tuổi không ạ? em học muộn 2 năm, 2k2 giờ sắp lên năm 3, em muốn vay sinh viên thì có được không ạ?', 'Em liên hệ với Ngân hàng chính sách xã hội ở địa phương để được hỗ trợ, tư vấn em nhé.']"
"Mọi người ơi cho em hỏi, em là tstd từng học ở trường khác, em đã đi quân sự rồi, bây giờ em vào lại trường mình có cần phải đi quân sự nữa không ạ? Nếu không thì cho em hỏi là thay vì đi quân sự thời gian đó em có được học các môn khác không ạ?",15 Tháng 8,3,0,0,0,0,0,0,0,"['Mọi người ơi cho em hỏi, em là tstd từng học ở trường khác, em đã đi quân sự rồi, bây giờ em vào lại trường mình có cần phải đi quân sự nữa không ạ? Nếu không thì cho em hỏi là thay vì đi quân sự thời gian đó em có được học các môn khác không ạ?', 'Nếu cậu có chứng chỉ rồi thì lên nộp ở phòng công tác sinh viên nhé', 'Muốn biết rõ hơn thì cậu ib tớ, năm vừa rồi tớ cũng được miễn qpan á']"
Cho e hỏi như này là được công chứng chưa ạ,15 Tháng 8,6,0,0,0,0,0,0,0,"['Cho e hỏi như này là được công chứng chưa ạ', 'Giấy cn tn tạm thời ni ko cần công chứng e nha. Chỉ có công chứng đối với bằng tn thôi e (thí sinh tự do)', 'hình như chưa á, mình đi làm công chứng thì thấy có dấu là văn phòng công chứng... ( tên vp đó ) á b']"
BẢN SAO HỌC BẠ NHƯ THẾ NÀO LÀ HỢP LỆ Ạ,14 Tháng 8,12,0,0,0,0,0,0,0,"['BẢN SAO HỌC BẠ NHƯ THẾ NÀO LÀ HỢP LỆ Ạ', 'cái này mình coi ở đâu vậy ạ', 'Bản sao hợp lệ là bản photo full các trang, rõ ràng đó e']"
"Cho em hỏi có ai thi toeic giấy ở trường mình ko ạ, review giúp em vớii, em định đăng kí thi ở trường mình ạ",13 Tháng 8,3,0,0,0,0,0,0,0,"['Cho em hỏi có ai thi toeic giấy ở trường mình ko ạ, review giúp em vớii, em định đăng kí thi ở trường mình ạ', 'Trường mình hình như hết tổ chức thi Toeic tại trường r á bạn. Mình vừa thi Toeic xong, đăng kí học và thi ở Flic mà các chị kêu là phải ra iig thi chứ trường mình lâu r ko tổ chức.']"
Anh chị ơi cho em hỏi để săn đc học bổng thì chỉ cần kết quả học tập trên 2.5/4 và điểm rèn luyện khá là đc hay sao ạ?,14 Tháng 8,6,0,0,0,0,0,0,0,"['Anh chị ơi cho em hỏi để săn đc học bổng thì chỉ cần kết quả học tập trên 2.5/4 và điểm rèn luyện khá là đc hay sao ạ?', 'Không có đâu em :)))))', 'GPA 2.5 và đrl Khá trở lên là đủ điều kiện để xét học bổng thôi nhé. Còn danh sách sẽ lấy từ trên xuống cho đến hết quỹ học bổng, thường thì Xuất sắc và Giỏi có khả năng cao nhận được học bổng hơn (tuỳ ngành).']"
dạ cho em hỏi sau khi nhập học tại trường thì khoảng mấy ngày là thi tiếng anh đầu vào vậy ạ,14 Tháng 8,6,0,0,0,0,0,0,0,"['dạ cho em hỏi sau khi nhập học tại trường thì khoảng mấy ngày là thi tiếng anh đầu vào vậy ạ', 'Năm ngoái nhập học 7,8t9 thì 9t9 chị thi TA đầu vào, ngày 10t9 là SHCD luôn á em.', 'Tầm 1,2 ngày sau nhập học nha em']"
"Anh chị khoá trên cho em xin đầy đủ hồ sơ nhập học với ạ 
Cái gì cần công chứng hay sao cho em xin rõ với ạaaaa",14 Tháng 8,1,0,0,0,0,0,0,0,"['Anh chị khoá trên cho em xin đầy đủ hồ sơ nhập học với ạ \nCái gì cần công chứng hay sao cho em xin rõ với ạaaaa', 'Em tham khảo năm trước nhaa']"
"cho em hỏi lí lịch hssv thì mình đi công chứng tại nơi mình ở đúng k ạ
vs lại chỗ nghành học thì mình ghi mã số của nghành hay sao ạ
e cảm ơn ạ",14 Tháng 8,1,0,0,0,0,0,0,0,"['cho em hỏi lí lịch hssv thì mình đi công chứng tại nơi mình ở đúng k ạ\nvs lại chỗ nghành học thì mình ghi mã số của nghành hay sao ạ\ne cảm ơn ạ', 'Không cần sơ yếu lý lịch nha em, em mang theo đúng các giấy tờ nhập học mà trường đưa ra là được nè']"
Dạ mn cho mik hỏi là mik đậu hb nv1 r thì ko cần xác nhận nhập học trên hệ thống đk ạ ( tại mik ko th chổ xác nhận nên nghĩ z ) mong mn cho mik bt vs ạ .,14 Tháng 8,2,0,0,0,0,0,0,0,"['Dạ mn cho mik hỏi là mik đậu hb nv1 r thì ko cần xác nhận nhập học trên hệ thống đk ạ ( tại mik ko th chổ xác nhận nên nghĩ z ) mong mn cho mik bt vs ạ .', 'Em cần phải xác nhận nhập học trên hệ thống nữa nha\nVà sau khi biết kết quả trúng tuyển thì em sẽ xác nhận nhập học trên hệ thống của Bộ Giáo dục và Đào tạo.', 'E cần phải xác nhận trên hệ thống bộ nữa nha']"
Cho e hỏi ngày mấy là bắt đầu nhập học trên bộ và bao giờ thì trường sẽ gửi mail xác nhận nhập học ạ . Em cảm ơn ạ,14 Tháng 8,5,0,0,0,0,0,0,0,"['Cho e hỏi ngày mấy là bắt đầu nhập học trên bộ và bao giờ thì trường sẽ gửi mail xác nhận nhập học ạ . Em cảm ơn ạ', 'Sau khi có điểm chuẩn em nha, em theo dõi trên page trường để nắm thông tin nhé.', 'Các bạn tân sinh viên vẫn đang còn loay hoay,chưa biết ôn luyện TA đầu vào ntn thì chủ động ib chị gửi tài liệu miễn phí nhé.']"
"Cho e hỏi là trường mình vẫn xếp lớp rồi cả lớp học chung với nhau hết các môn như cấp 3 hay là mình đăng kí học thầy, cô mà mình muốn rồi đến giảng đường học hay sao ạ. E cảm ơn",14 Tháng 8,2,0,0,0,0,0,0,0,"['Cho e hỏi là trường mình vẫn xếp lớp rồi cả lớp học chung với nhau hết các môn như cấp 3 hay là mình đăng kí học thầy, cô mà mình muốn rồi đến giảng đường học hay sao ạ. E cảm ơn', 'Trường xếp lịch học cứng 1 số môn cố định là mình sẽ học theo lớp sinh hoạt của mình, còn 1 số môn khác mình tự đăng kí thì mình học theo lớp môn đó nha. E có thể join group Quản Trị Kinh Doanh Tổng Quát ni để anh chị hỗ trợ nè', 'Các bạn tân sinh viên vẫn đang còn loay hoay,chưa biết ôn luyện TA đầu vào ntn thì chủ động ib chị gửi tài liệu miễn phí nhé.']"
"Chính xác là nhập học ngày 21, 22 phải không ạ",14 Tháng 8,2,0,0,0,0,0,0,0,"['Chính xác là nhập học ngày 21, 22 phải không ạ', 'Chưa có tbao chính thức e nha. E theo dõi web và page trường nha', 'Các bạn tân sinh viên vẫn đang còn loay hoay,chưa biết ôn luyện TA đầu vào ntn thì chủ động ib chị gửi tài liệu miễn phí nhé.']"
Dạ ac cho e hỏi là trường mình thường thì khi nào đi quân sự và đi trong bao lâu vậy ạ.,14 Tháng 8,1,0,0,0,0,0,0,0,"['Dạ ac cho e hỏi là trường mình thường thì khi nào đi quân sự và đi trong bao lâu vậy ạ.', 'Có 2 đợt em\nTuỳ vào khoa sẽ đi vào đợt nào em nhé\nĐợt 1 sau tết… Xem thêm']"
Ac cho e hỏi sơ yếu lí lịch sinh viên trường mình dùng mẫu chung của bộ hay mẫu riêng của trường ạ? Sơ yếu lí lịch đó có cần dấu công chứng của xã k ạ?,13 Tháng 8,1,0,0,0,0,0,0,0,"['Ac cho e hỏi sơ yếu lí lịch sinh viên trường mình dùng mẫu chung của bộ hay mẫu riêng của trường ạ? Sơ yếu lí lịch đó có cần dấu công chứng của xã k ạ?', 'Em tham khảo hồ sơ nhập học nha']"
dạ cho em hỏi học phí năm đầu là nộp hết hay là chia ra từng kì vậy ạ e,13 Tháng 8,5,0,0,0,0,0,0,0,"['dạ cho em hỏi học phí năm đầu là nộp hết hay là chia ra từng kì vậy ạ e', 'nộp trước 1 kỳ á', 'Chia ra 2 kỳ nha em.']"
"sao 21/8 nhập học rồi mà hiện tại trường vẫn chưa có thông báo gì về các hồ sơ và khoản phí cần nộp vậy ạ, với cho em hỏi là nhập học là mình đóng học phí luôn hay sao ạ. Em cảm ơn ạ",13 Tháng 8,4,0,0,0,0,0,0,0,"['sao 21/8 nhập học rồi mà hiện tại trường vẫn chưa có thông báo gì về các hồ sơ và khoản phí cần nộp vậy ạ, với cho em hỏi là nhập học là mình đóng học phí luôn hay sao ạ. Em cảm ơn ạ', 'như năm ngoái là em chuyển khoản vào tk của trường nha e, năm ni thì e cứ đợi tbao hướng dẫn trên web và page trường nha!', 'Sau khi biết kết quả trúng tuyển và xác nhận nhập học thì trường sẽ gửi em các thông tin về hồ sơ cần chuẩn bị cũng như các khoản phí cần nộp nha. Em nộp trước khi nhập học á.']"
Dạ cho e hỏi ở khu vực trường Kinh Tế có trung tâm nào dạy tiếng anh chất lượng mà học phí rẻ k ạ.,13 Tháng 8,4,0,0,0,0,0,0,0,"['Dạ cho e hỏi ở khu vực trường Kinh Tế có trung tâm nào dạy tiếng anh chất lượng mà học phí rẻ k ạ.', 'Gia sư kèm tiếng Anh online 1:1 chỉ 66k/ buổi, được học thử miễn phí, được chủ động sắp xếp lịch học phù hợp. Quan tâm thì ib mình nhé', 'Đây bạn nhé https://www.facebook.com/FLIC.DUE.UDN.VN']"
Dạ anh chị cho em hỏi mục này là 1 trong 2 hay cả 2 ạ,13 Tháng 8,5,0,0,0,0,0,0,0,"['Dạ anh chị cho em hỏi mục này là 1 trong 2 hay cả 2 ạ', 'Cho em hỏi cái 1 và 2 là ra ngoài trường làm hay sao ạ.', 'Cả 2 nha em, gồm 1 bản chính và 1 bản photo công chứng']"
"E có vài thắc mắc mong ac hỗ trợ ạ. E cảm ơn!
1. Hôm nhập học có chụp ảnh thẻ để làm thẻ SV hay là SV tự nộp ảnh thẻ ạ?
2. Khám sức khỏe SV là khám tại trường hay là SV tự đi khám rồi tới hôm nhập học mang theo giấy chứng nhận khám sức khỏe?
3. Ngày nộp hồ sơ đăng kí KTX thì mình có được nhận phòng liền không ạ hay có thông báo ngày khác?( e thắc mắc là giường KTX là giường tầng như trong học quân sự phải không ạ?)",12 Tháng 8,2,0,0,0,0,0,0,0,"['E có vài thắc mắc mong ac hỗ trợ ạ. E cảm ơn!\n1. Hôm nhập học có chụp ảnh thẻ để làm thẻ SV hay là SV tự nộp ảnh thẻ ạ?\n2. Khám sức khỏe SV là khám tại trường hay là SV tự đi khám rồi tới hôm nhập học mang theo giấy chứng nhận khám sức khỏe?\n3. Ngày nộp hồ sơ đăng kí KTX thì mình có được nhận phòng liền không ạ hay có thông báo ngày khác?( e thắc mắc là giường KTX là giường tầng như trong học quân sự phải không ạ?)', 'Chào em\n1,2) Không biết năm nay quy trình thủ tục của trường như thế nào nên em theo dõi Fanpage của trường để nắm thông tin nha\n3) Giường ktx là giường tầng nha', 'Theo như 49K năm trước thì mình nộp ảnh thẻ mình tự chuẩn bị nha, và hôm đó khám sức khoẻ ngay tại trường luôn á em']"
Em xin review về 2 chuyên ngành truyền thông marketing và digital marketing với ạaaa,11 Tháng 8,1,0,0,0,0,0,0,0,"['Em xin review về 2 chuyên ngành truyền thông marketing và digital marketing với ạaaa', 'Mình không học 2 chuyên ngành này nma nếu bạn muốn tìm hiểu thông tin cũng như cơ hội nghề nghiệp của 2 chuyên ngành đó thì có thể ib mình.']"
"Anh/chị cho em hỏi, năm 2025 với khoá 51K thì trường mình sẽ tuyển thí sinh tự do bằng chương trình cũ hay chương trình mới ạ?",12 Tháng 8,1,0,0,0,0,0,0,0,"['Anh/chị cho em hỏi, năm 2025 với khoá 51K thì trường mình sẽ tuyển thí sinh tự do bằng chương trình cũ hay chương trình mới ạ?', 'Hiện tại chưa có đề án tuyển sinh năm 2025 e nha. E cứ chờ trg thông báo đề án']"
 [KHAI GIẢNG CÁC KHÓA HỌC TOEIC THÁNG 08/2024] ,12 Tháng 8,1,0,0,0,0,0,0,0,"[' [KHAI GIẢNG CÁC KHÓA HỌC TOEIC THÁNG 08/2024] ', 'Học ngay tại trường, chi phí rẻ, tỷ lệ PASS cao']"
" MỞ XÉT TUYỂN HỌC BẠ ĐỢT 2
CHƯƠNG TRÌNH CỬ NHÂN LIÊN KẾT QUỐC TẾ - LIÊN KẾT ĐẠI HỌC COVENTRY VỚI TRƯỜNG ĐẠI HỌC KINH TẾ, ĐẠI HỌC ĐÀ NẴNG.
 Nếu các bạn có thắc mắc về lộ trình đào tạo đừng ngần ngại nhắn tin trực tiếp cho Fanpage Đào Tạo Đào tạo Quốc tế - Trường Đại học Kinh Tế, Đại học Đà Nẵng để DUE kịp thời giải đáp cho bạn nhé!!!",6 Tháng 8,3,0,0,0,0,0,0,0,"[' MỞ XÉT TUYỂN HỌC BẠ ĐỢT 2\nCHƯƠNG TRÌNH CỬ NHÂN LIÊN KẾT QUỐC TẾ - LIÊN KẾT ĐẠI HỌC COVENTRY VỚI TRƯỜNG ĐẠI HỌC KINH TẾ, ĐẠI HỌC ĐÀ NẴNG.\n Nếu các bạn có thắc mắc về lộ trình đào tạo đừng ngần ngại nhắn tin trực tiếp cho Fanpage Đào Tạo Đào tạo Quốc tế - Trường Đại học Kinh Tế, Đại học Đà Nẵng để DUE kịp thời giải đáp cho bạn nhé!!!', 'XÉT TUYỂN HỌC BẠ CHƯƠNG TRÌNH CỬ NHÂN ĐẠI HỌC COVENTRY NGAY TẠI TRƯỜNG ĐẠI HỌC KINH TẾ, ĐẠI HỌC ĐÀ NẴNG\nĐỢT 2 ĐẾN NGÀY 16/8', 'Và xin mức học phí ch trình liên kết quốc tế này', '100% học bổng đầu vào cụ thể là như thế nào vậy ad?']"
 HƯỚNG DẪN CHUYỂN SINH HOẠT ĐẢNG CHO ĐẢNG VIÊN - TÂN SINH VIÊN KHOÁ 50K ,11 Tháng 8,3,0,0,0,0,0,0,0,"[' HƯỚNG DẪN CHUYỂN SINH HOẠT ĐẢNG CHO ĐẢNG VIÊN - TÂN SINH VIÊN KHOÁ 50K ', 'Nguyễn Hùng Vĩ chuẩn bị thôi nào', '50K làm quen ạ']"
Cho e hỏi là học phí sẽ nộp theo từng kì hay là nộp theo từng năm luôn ạ? Em cảm ơn ạ,8 Tháng 8,4,0,0,0,0,0,0,0,"['Cho e hỏi là học phí sẽ nộp theo từng kì hay là nộp theo từng năm luôn ạ? Em cảm ơn ạ', 'Học phí trường sẽ thu theo kì nhé em ơi', 'Học phí đóng theo từng kì nhaa em !']"
