PostContent,Date,NumberOfComment,Like,Heart,Care,Haha,Wow,Sad,Angry,ContentofComment
"Dạ a/c cho em hỏi là em xts đậu ngành QTKD, nhưng mà sau này em muốn đặt này thành NV3, nếu 2 NV đầu em xét bằng điểm thi TN nhưng trượt thì em có chắc chắn đậu NV3 không ạ?",25 Tháng 6,1,0,0,0,0,0,0,0,"['Dạ a/c cho em hỏi là em xts đậu ngành QTKD, nhưng mà sau này em muốn đặt này thành NV3, nếu 2 NV đầu em xét bằng điểm thi TN nhưng trượt thì em có chắc chắn đậu NV3 không ạ?', 'Có e nha']"
"Ở ĐN có chỗ nào dạy và thi MOS ko ạ?
Với lại cho em hỏi là thi cntt nâng cao và MOS thì cái nào khó hơn ạ???",24 Tháng 6,12,0,0,0,0,0,0,0,"['Ở ĐN có chỗ nào dạy và thi MOS ko ạ?\nVới lại cho em hỏi là thi cntt nâng cao và MOS thì cái nào khó hơn ạ???', 'MOS thi đắt hơn nhiều, công việc sau này cần MOS thì thi còn nếu ra trường thôi thì NC cho dễ với rẻ hơn', '.']"
"các anh chị cho em xin review về ngành Kế Toán ạ :)))
 Tiện đây cho em tìm các anh chị và các bạn cùng ngành với ạ",24 Tháng 6,9,0,0,0,0,0,0,0,"['các anh chị cho em xin review về ngành Kế Toán ạ :)))\n Tiện đây cho em tìm các anh chị và các bạn cùng ngành với ạ', 'có anh chị hay bạn nào cùng ngành với em không ạa', 'Chào em! Gửi em một số thông tin về ngành Kế toán nhé. Khoa Kế toán chào đón các em!']"
"Cho em hỏi là ở mức cấp 100% học phí mục 2 thì nếu em xét học bạ vào trường (pt3) thì có được tính không ạ hay phải là điểm cả 3 năm ạ. Với một số ngành lấy điểm chuẩn từ 27,5-28 thì những bạn trúng tuyển những ngành đó sẽ auto nhận học bổng 100% ạ?",23 Tháng 6,18,0,0,0,0,0,0,0,"['Cho em hỏi là ở mức cấp 100% học phí mục 2 thì nếu em xét học bạ vào trường (pt3) thì có được tính không ạ hay phải là điểm cả 3 năm ạ. Với một số ngành lấy điểm chuẩn từ 27,5-28 thì những bạn trúng tuyển những ngành đó sẽ auto nhận học bổng 100% ạ?', '49k ngoại trừ mấy bạn có giải quốc gia quốc tế thì mình k rõ chứ học bạ 28,17 trở lên mới có hb nhé', 'Nhập học vào bằng pt nào thì xét học bổng bằng pt ấy e. Xét thứ tự ut từ 1->11 như trong bảng cho đến khi hết quỹ học bổng']"
dạ mn cho em hỏi học bổng cho tân sinh viên là được thông báo lúc mình chính thức nhập học hay trước đó ạ,24 Tháng 6,1,0,0,0,0,0,0,0,"['dạ mn cho em hỏi học bổng cho tân sinh viên là được thông báo lúc mình chính thức nhập học hay trước đó ạ', 'Sau khi nhập học thì trường mới tiến hành xét học bổng này em nhé']"
"dạ các anh chị cho e xin rì viu về chương trình bán phần,toàn phần TA và full tiếng việt của KDQT vứi ạ. Dạ cho e hỏi là mình được tự chọn chương trình hay trường chọn ạ?",23 Tháng 6,4,0,0,0,0,0,0,0,"['dạ các anh chị cho e xin rì viu về chương trình bán phần,toàn phần TA và full tiếng việt của KDQT vứi ạ. Dạ cho e hỏi là mình được tự chọn chương trình hay trường chọn ạ?', 'E đc tự chọn nha. Còn chi tiết các ctrinh e liên hệ khoa để đc tư vấn nha. Khoa kinh doanh quốc tế', 'Bạn tính học full tiếng việt hay full anh dợ']"
"Hiện tại thì em xét vào trường nhờ chứng chỉ ngoại ngữ, là theo pt2. Và kết quả học bạ của em là trên 27,5 nhưng em ko xét học bạ thì có được nhận học bổng ko ạ. Với lại cho em hỏi học bổng là mình đăng kí hay là sao ạ.",24 Tháng 6,3,0,0,0,0,0,0,0,"['Hiện tại thì em xét vào trường nhờ chứng chỉ ngoại ngữ, là theo pt2. Và kết quả học bạ của em là trên 27,5 nhưng em ko xét học bạ thì có được nhận học bổng ko ạ. Với lại cho em hỏi học bổng là mình đăng kí hay là sao ạ.', 'Em đậu vào trường bằng pt2 thì sẽ lấy thành tích pt2 xét nha, hc bổng cho tsv sẽ do trường xét theo thứ tự ưu tiên cho đến khi hết quỹ hc bổng']"
"Dạ ac cho e hỏi, những chuyên ngành trong QTKD ngành nào học nặng về toán nhất ạ?E học toán chỉ ở mức tạm ổn thôi ạ.",24 Tháng 6,15,0,0,0,0,0,0,0,"['Dạ ac cho e hỏi, những chuyên ngành trong QTKD ngành nào học nặng về toán nhất ạ?E học toán chỉ ở mức tạm ổn thôi ạ.', 'Chị thấy đã là sinh viên kinh tế thì việc tính toán là không thể tránh khỏi. Chuyên ngành nào thì chị thấy cũng tính như nhau thôi à. Nhưng em không cần lo là nó sẽ quá khó như toán thi đại học từ câu 45-50 vì toán ở đại học là ứng dụng thực tế nên qua… Xem thêm', 'Chuyên ngành nào cũng nặng toán hết á em ơi =))']"
"dạ mọi ng ơi, nếu như em đậu học bạ ngành A nhưng em muốn thi THPTQG vào ngành B, em kh đủ điểm ngành B thì có được học ngành A đã đậu học bạ không ạ",24 Tháng 6,1,0,0,0,0,0,0,0,"['dạ mọi ng ơi, nếu như em đậu học bạ ngành A nhưng em muốn thi THPTQG vào ngành B, em kh đủ điểm ngành B thì có được học ngành A đã đậu học bạ không ạ', 'Nếu em đặt nv1 là ngành xét bằng điểm thi, nv2 là ngành xét hc bạ ( đã trúng tuyển) thì rớt nv1 sẽ đậu nv2 nha']"
"Thứ tự ưu tiên 2: 
+ Mình lấy kết quả học tập THPT là điểm tổng phẩy cuối năm có được không ạ (em xét tsr)?
+ Nếu bằng đúng 27.5 thì có được không?",24 Tháng 6,7,0,0,0,0,0,0,0,"['Thứ tự ưu tiên 2: \n+ Mình lấy kết quả học tập THPT là điểm tổng phẩy cuối năm có được không ạ (em xét tsr)?\n+ Nếu bằng đúng 27.5 thì có được không?', 'Xét tuyển sinh riêng thì ko có cơ hội mô bạn ơi', '- Kết quả hc tập lớp 10+11+ hk1 lớp 12\n- Sẽ xét hc bổng theo thứ tự ưu tiên cho đến khi hết quỹ hc bổng em nha']"
Cho e hỏi là có bao nhiêu phần học bổng với mình tự đăng kí học bổng hay học bổng tự động ạ,24 Tháng 6,3,0,0,0,0,0,0,0,"['Cho e hỏi là có bao nhiêu phần học bổng với mình tự đăng kí học bổng hay học bổng tự động ạ', 'Hc bổng cho tsv trường sẽ xét theo thành tích mà em đậu vào trường nha. Sẽ xét theo thứ tự ưu tiên cho đến khi hết quỹ hc bổng, không có số lượng cố định']"
"Dạ em 2k7 ạ, cho em hỏi nếu em xét học bạ A00 mà em thi TN A01 có được không ạ",24 Tháng 6,1,0,0,0,0,0,0,0,"['Dạ em 2k7 ạ, cho em hỏi nếu em xét học bạ A00 mà em thi TN A01 có được không ạ', 'Đc em nha']"
"trường mình yêu cầu ra trường phải có bằng ielts phải k ạ 
e học tàu chính ngân hàng ạ",23 Tháng 6,3,0,0,0,0,0,0,0,"['trường mình yêu cầu ra trường phải có bằng ielts phải k ạ \ne học tàu chính ngân hàng ạ', 'Tuỳ từng khoá á e, khi vô nhập học tuần sinh hoạt công dân e sẽ đc phổ biến']"
Cho em hỏi học tài chính doanh nghiệp thì cơ hội việc làm ở Đà Nẵng như thế nào vậy ạ?,"21 Tháng 7, 2023",18,0,0,0,0,0,0,0,"['Cho em hỏi học tài chính doanh nghiệp thì cơ hội việc làm ở Đà Nẵng như thế nào vậy ạ?', 'Trương Đức Tài Trần Thảo Đinh Nhật Vy anh chị có 3 phút để giải trình lý do không nên chọn học Tài chính doanh nghiệp', 'Nguyễn Thị Thu Hương review cho mấy em kìaaaaa c']"
Mọi người cho em hỏi là chừ mình xét đậu rồi mà trường không gửi mail về thì vẫn đậu đk ạ,23 Tháng 6,9,0,0,0,0,0,0,0,"['Mọi người cho em hỏi là chừ mình xét đậu rồi mà trường không gửi mail về thì vẫn đậu đk ạ', 'ĐHĐN kh gửi mail đâu bạn', 'Tra cứu trúng tuyển có điều kiện là đậu xét tuyển sớm rồi đó e']"
mn ơi e nghe bảo học xong năm nhất là có thể học song nghành đúng không ạ? em có thể tìm hiểu thông tin này ở đâu được ạ?,23 Tháng 6,2,0,0,0,0,0,0,0,"['mn ơi e nghe bảo học xong năm nhất là có thể học song nghành đúng không ạ? em có thể tìm hiểu thông tin này ở đâu được ạ?', 'E vô đây, đọc Quyết định số 1284 điều 19 nha: http://due.udn.vn/.../daotao/daotaochitiet/id/16300/cid/5181']"
Ac cho e hỏi ct 50% TA 50% Tv thì mình sẽ học TA những môn nào và tv những môn nào dc k ạ,23 Tháng 6,1,0,0,0,0,0,0,0,"['Ac cho e hỏi ct 50% TA 50% Tv thì mình sẽ học TA những môn nào và tv những môn nào dc k ạ', 'Đầu năm nhập học e gặp trực tiếp các thầy cô sẽ đc tư vấn nhé']"
Ac cho em hỏi học phí ngành Kinh doanh quốc tế 1 năm là bao nhiêu vậy ạ,23 Tháng 6,3,0,0,0,0,0,0,0,['Ac cho em hỏi học phí ngành Kinh doanh quốc tế 1 năm là bao nhiêu vậy ạ']
"Cho e hỏi xét học bỗng là xét cho tới khi hết quỹ, vậy từ thứ tự 1 đến 11 trong nhóm xét ví dụ quỹ hết ở nhóm nào thì cắt luôn ạ? giống như xét chỉ tiêu ngành học ấy ạ?? ",23 Tháng 6,1,0,0,0,0,0,0,0,"['Cho e hỏi xét học bỗng là xét cho tới khi hết quỹ, vậy từ thứ tự 1 đến 11 trong nhóm xét ví dụ quỹ hết ở nhóm nào thì cắt luôn ạ? giống như xét chỉ tiêu ngành học ấy ạ?? ', 'Thì xét đến nhóm nào mà quỹ hết thì dừng e. Vd như xét tới nhóm 9 mà hết quỹ thì dừng']"
[ĐIỂM CHUẨN XÉT TUYỂN CÓ ĐIỀU KIỆN],21 Tháng 6,97,0,0,0,0,0,0,0,"['[ĐIỂM CHUẨN XÉT TUYỂN CÓ ĐIỀU KIỆN]', 'Phải cố để đậu phương thức 5 nhóm 8 =((', '.']"
"Dạ mng ơi cho e hỏi với ạ
Nếu mình đậu ngành của trường r, nhma mình đặt nv2 
Còn nv1 mình thi spham 
Nếu rớt có đc học nv2 k ạ, tại có mấy bài e thấy ngta bảo phải để NV1 thì mới đc ",23 Tháng 6,2,0,0,0,0,0,0,0,"['Dạ mng ơi cho e hỏi với ạ\nNếu mình đậu ngành của trường r, nhma mình đặt nv2 \nCòn nv1 mình thi spham \nNếu rớt có đc học nv2 k ạ, tại có mấy bài e thấy ngta bảo phải để NV1 thì mới đc ', 'Có nha e']"
Cho e hỏi là thời hạn đki pt xét tuyển sớm là khi nào hết hạn v ạ và khi nào mới đki nv trên hệ thống bộ v ạ..,23 Tháng 6,1,0,0,0,0,0,0,0,"['Cho e hỏi là thời hạn đki pt xét tuyển sớm là khi nào hết hạn v ạ và khi nào mới đki nv trên hệ thống bộ v ạ..', 'Hết đăng kí pt xét tuyển sớm rồi em, Biết điểm THPTQG xong sẽ đăng kí nv trên hệ thống của bộ nha']"
Cho em hỏi với ạ: nếu mình đậu nv học bạ rồi thì có cần để nv học bạ lên nv1 ko ạ,23 Tháng 6,7,0,0,0,0,0,0,0,"['Cho em hỏi với ạ: nếu mình đậu nv học bạ rồi thì có cần để nv học bạ lên nv1 ko ạ', 'Có em.', 'Em muốn chắc chắn đậu vào nv đã đậu học bạ đấy thì nên để ở nv1 nhé']"
mn ơi cho e hỏi là trúng tuyển có đk rồi thì khi thi chỉ cần đủ điểm tốt nghiệp nữa là đỗ vào trường luôn đúng không ạ,23 Tháng 6,1,0,0,0,0,0,0,0,"['mn ơi cho e hỏi là trúng tuyển có đk rồi thì khi thi chỉ cần đủ điểm tốt nghiệp nữa là đỗ vào trường luôn đúng không ạ', 'Đúng r e']"
Cho e xin review chi tiết của anh chị khoá trước về ngành kdqt chương trình đào tạo bằng TA ạaaa.,23 Tháng 6,1,0,0,0,0,0,0,0,"['Cho e xin review chi tiết của anh chị khoá trước về ngành kdqt chương trình đào tạo bằng TA ạaaa.', 'cho mình hỏi đc chọn chương trình học ạ']"
"Em hỏi này với ạ,ví dụ điểm quy đổi ielts 5.5 là 288 rồi cộng thêm điểm 2 môn toán và tự chọn mà sao điểm chuẩn ngành QTKD là 245,33 thấp hơn điểm quy đổi là sao ạ ?",23 Tháng 6,8,0,0,0,0,0,0,0,"['Em hỏi này với ạ,ví dụ điểm quy đổi ielts 5.5 là 288 rồi cộng thêm điểm 2 môn toán và tự chọn mà sao điểm chuẩn ngành QTKD là 245,33 thấp hơn điểm quy đổi là sao ạ ?', '- Chỉ qui đổi ielts thôi chớ k có cộng điểm 2 môn nha\n- Điểm chuẩn này là của cả pt2 (từ nhóm 2 - nhóm 5) chớ k chỉ xét cho 1 nhóm 4 em nha']"
Cho em xin review về chuyên ngành sự kiện của ngành quản trị dịch vụ du lịch và lữ hành được không ạ ?,23 Tháng 6,7,0,0,0,0,0,0,0,"['Cho em xin review về chuyên ngành sự kiện của ngành quản trị dịch vụ du lịch và lữ hành được không ạ ?', 'Chào em, hiện tại Khoa Du lịch thuộc trường Đại học Kinh tế - Đại học Đà Nẵng có 02 ngành đào tạo về Du lịch gồm: Quản trị dịch vụ du lịch & lữ hành và Quản trị khách sạn. Trong ngành Quản trị dịch vụ du lịch & lữ hành có 02 chuyên ngành đào tạo gồm: Q… Xem thêm', 'Chấm']"
"Các bạn cho xin bảng điểm quy đổi theo ielts của phương thức 2 nhóm 4 ạ
Con  cô ielts 6.5 mà sao không đậu ngành Luật kinh tế ạ (điểm chuẩn 294). Năm 2023 ielts 9.0 thì điểm quy đổi cũng chỉ 292 điểm. với điểm xét tuyển năm nay thì ielts sẽ không được trúng tuyển. Các bạn giải thích giúp PH nhé",22 Tháng 6,16,0,0,0,0,0,0,0,"['Các bạn cho xin bảng điểm quy đổi theo ielts của phương thức 2 nhóm 4 ạ\nCon  cô ielts 6.5 mà sao không đậu ngành Luật kinh tế ạ (điểm chuẩn 294). Năm 2023 ielts 9.0 thì điểm quy đổi cũng chỉ 292 điểm. với điểm xét tuyển năm nay thì ielts sẽ không được trúng tuyển. Các bạn giải thích giúp PH nhé', 'Dạ thưa cô là năm nay nhiều ngành tăng cao đều ạ. Đặc biệt ngành luật kinh tế cao vượt như vậy vì có xu hướng hot. Con giải nhì tỉnh 294 cũng chỉ vừa đậu thôi. Nếu mà bạn không xét mấy ngành khác nữa thì chắc phải cố gắng thi thpt thôi ạ. Vì DUE không … Xem thêm', '8-9 ielts chỉ có 292 đ còn giải 3 thì 293 đ, ngộ:)']"
"Cho e hỏi ạ, e đậu ngành tc-nh nhưng đây k phải là nv1 của e, e đặt nv1 ở trường khác và ngành này e đặt ở nv4 nếu có trật các nv trên có đậu ngành này ở nv4 k ạ",23 Tháng 6,1,0,0,0,0,0,0,0,"['Cho e hỏi ạ, e đậu ngành tc-nh nhưng đây k phải là nv1 của e, e đặt nv1 ở trường khác và ngành này e đặt ở nv4 nếu có trật các nv trên có đậu ngành này ở nv4 k ạ', 'Được em nhé! Nếu e rớt các nv 1,2,3 thì vẫn sẽ đậu nv4 nè']"
dạ mn cho e hỏi là nếu đậu hb thì họ gửi mail về vd k đậu họ có tbao v k ạ ( nếu k làm sao bt đc ạ),21 Tháng 6,64,0,0,0,0,0,0,0,"['dạ mn cho e hỏi là nếu đậu hb thì họ gửi mail về vd k đậu họ có tbao v k ạ ( nếu k làm sao bt đc ạ)', 'Có link tra cứu kq em nha', 'Có chưa v trời']"
"Dạ em đậu pt2 là xét tuyển sinh riêng ạ, nhma nếu em đặt nv trúng tuyển đó ở nv3  lên hệ thống bộ thì nếu có chắc chắn sẽ đậu ko ạ? Vì em nghe có nhiều người nói là ngta sẽ lấy từ nv1, nv2.. nên nếu xếp sau quá thì hết chỉ tiêu là ko lấy đến mình ấy. Vậy là trúng tuyển như này vẫn chưa chắc chắn ạ? Em lo quá ạ, mong mng giải thích cụ thể giúp em ạ. Em cảm ơn",22 Tháng 6,4,0,0,0,0,0,0,0,"['Dạ em đậu pt2 là xét tuyển sinh riêng ạ, nhma nếu em đặt nv trúng tuyển đó ở nv3  lên hệ thống bộ thì nếu có chắc chắn sẽ đậu ko ạ? Vì em nghe có nhiều người nói là ngta sẽ lấy từ nv1, nv2.. nên nếu xếp sau quá thì hết chỉ tiêu là ko lấy đến mình ấy. Vậy là trúng tuyển như này vẫn chưa chắc chắn ạ? Em lo quá ạ, mong mng giải thích cụ thể giúp em ạ. Em cảm ơn', 'K em, nếu em đặt NV đã trúng tuyển ở nv3 mà bị rớt NV 1,2 thì sẽ đậu nv3 ( nếu đủ đk tốt nghiệp )nha']"
"Điểm xét học bạ có cộng đ ưu tiên vùng miền ko ạ ,và cộng như thế nào ạ .",22 Tháng 6,4,0,0,0,0,0,0,0,"['Điểm xét học bạ có cộng đ ưu tiên vùng miền ko ạ ,và cộng như thế nào ạ .', 'Có em nhé, điểm sẽ được cộng theo quy chế tuyển sinh hiện hành của bộ em nhé', 'Cộng như điểm thi thpt lun cậu, điểm càng cao thì điểm cộng vùng càng giảm']"
"Cho PH hỏi : Con Cô đã trúng tuyển ngành QT khách sạn theo phương thức ielts, nay xin đổi sang ngành Luật được không ạ (cũng đủ điểm trúng tuyển). Cô cảm ơn",22 Tháng 6,10,0,0,0,0,0,0,0,"['Cho PH hỏi : Con Cô đã trúng tuyển ngành QT khách sạn theo phương thức ielts, nay xin đổi sang ngành Luật được không ạ (cũng đủ điểm trúng tuyển). Cô cảm ơn', 'con cô có xét pt ngành Luật ở pt khác không ạ, mà theo em nghĩ là nv1 là qtks thì họ lấy nv1 luôn í', 'Dạ nếu đã đậu ngành QT ks theo IELTS thì nếu muốn đổi chỉ có cách thi THPT và lấy kqua xét vào ngành Luật thôi ạ.']"
Mọi người ơi=)) ý là em lỡ đặt ngành điểm thấp lên nguyện vọng 1 rồi thì còn cách nào cứu không ạ…,22 Tháng 6,8,0,0,0,0,0,0,0,"['Mọi người ơi=)) ý là em lỡ đặt ngành điểm thấp lên nguyện vọng 1 rồi thì còn cách nào cứu không ạ…', 'đi ngủ luôn đi em.']"
- Điều kiện 3: Ngành trúng tuyển là nguyện vọng cao nhất trong số các nguyện vọng đủ điều kiện trúng tuyển khi thí sinh đăng kí trên Hệ thống của Bộ Giáo dục & Đào tạo,22 Tháng 6,6,0,0,0,0,0,0,0,"['- Điều kiện 3: Ngành trúng tuyển là nguyện vọng cao nhất trong số các nguyện vọng đủ điều kiện trúng tuyển khi thí sinh đăng kí trên Hệ thống của Bộ Giáo dục & Đào tạo', 'Đúng r e, nếu e rớt nv 1 (xét điểm thi) thì nv 2 (e đặt ngành Kinh tế đã trúng tuyển sớm) sẽ là nv cao nhất của e', 'bạn xem các điều kiện này ở đâu v ạ']"
Mọi người ơi cho e hỏi e đã trúng tuyển vào đại học kinh tế và được miễn thi ngoại ngữ thì đến ngày thi môn tiếng anh e ko cần thi cũng được phải ko ạ?,22 Tháng 6,1,0,0,0,0,0,0,0,"['Mọi người ơi cho e hỏi e đã trúng tuyển vào đại học kinh tế và được miễn thi ngoại ngữ thì đến ngày thi môn tiếng anh e ko cần thi cũng được phải ko ạ?', 'Ai giải đáp cho e vớii ạ huhu']"
Cơ hội XÉT HỌC BẠ vẫn còn để theo học chương trình đẳng cấp Quốc tế tại trường Đại học kinh tế Đà Nẵng,22 Tháng 6,2,0,0,0,0,0,0,0,"['Cơ hội XÉT HỌC BẠ vẫn còn để theo học chương trình đẳng cấp Quốc tế tại trường Đại học kinh tế Đà Nẵng', 'Tổng kết hội trại với giải nhất flashmod 🤟', 'Chương trình Cử Nhân Liên Kết Quốc Tế vẫn đang mở đơn xét tuyển HỌC BẠ, các bạn 2k6 ơi đây là cơ hội để các bạn theo học chương trình đẳng cấp Quốc Tế tại trường Đại Học Kinh Tế Đà Nẵng nhé']"
"cho em hỏi điều kiện 3 là bắt buộc để NV1 hay sao ạ??
Nếu em đặt ở NV2 thì khi ko đậu NV1 thì NV2 em có chắc chắn đậu ko ạ, em cảm ơn ạ",22 Tháng 6,3,0,0,0,0,0,0,0,"['cho em hỏi điều kiện 3 là bắt buộc để NV1 hay sao ạ??\nNếu em đặt ở NV2 thì khi ko đậu NV1 thì NV2 em có chắc chắn đậu ko ạ, em cảm ơn ạ', 'cùng câu hỏi', 'Nguyện vọng cao nhất trong số các nguyện vọng có điều kiện trúng tuyển tức là nếu NV1 là dùng điểm thi THPT QG, NV2 học bạ nhưng NV1 rớt do không đủ điểm (không đủ điều kiện trúng tuyển) thì NV2 được xem là NV cao nhất đủ điều kiện trúng tuyển em nhé.']"
Dạ cho e hỏi là chương trình cử nhân liên kết quốc tế và chương trình cử nhân chính quy quốc tế khác nhau như nào v ạ,22 Tháng 6,1,0,0,0,0,0,0,0,"['Dạ cho e hỏi là chương trình cử nhân liên kết quốc tế và chương trình cử nhân chính quy quốc tế khác nhau như nào v ạ', '- Chương trình Cử Nhân Liên Kết Quốc Tế giảng dạy 100% Tiếng Anh và có các giáo viên người nước ngoài giảng dạy.\n- Các bạn có IELTS từ 5.5 trở lên sẽ đủ điều kiện xét tuyển và có IELTS từ 6.5 trở lên tuyển thẳng vào chuyên ngành. Lộ trình đào tạo là 3 … Xem thêm']"
Cho e ít review cụ thể logictics ở mảng quản trị kinh doanh là học nhwu nào ạ,22 Tháng 6,9,0,0,0,0,0,0,0,"['Cho e ít review cụ thể logictics ở mảng quản trị kinh doanh là học nhwu nào ạ', 'Em có thể đọc chi tiết về chương trình đào tạo của chuyên ngành Quản trị Chuỗi Cung Ứng & Logistics tại link sau: http://due.udn.vn/.../quan-tri.../chitiet/id/17505/cid/3481\nVà lộ trình đào tạo chi tiết cho 4 năm tại link sau: http://due… Xem thêm', 'Huy Ngô hỗ trợ bạn kìa']"
"Mọi người ơi cho em hỏi ạ, chuyện là em đã đậu pt xét tuyển sớm. Tuy nhiên điều kiện trúng tuyển của trường là phải đặt nv1. Nhưng đây chỉ là nv3 của e, nêu e đặt nv3 và trong trường hợp e rớt các nv trên thì trường có còn nhận không ạ?",22 Tháng 6,3,0,0,0,0,0,0,0,"['Mọi người ơi cho em hỏi ạ, chuyện là em đã đậu pt xét tuyển sớm. Tuy nhiên điều kiện trúng tuyển của trường là phải đặt nv1. Nhưng đây chỉ là nv3 của e, nêu e đặt nv3 và trong trường hợp e rớt các nv trên thì trường có còn nhận không ạ?', 'Theo quy chế tuyển sinh thì bạn có thể đặt NV1, NV2,.. để xét tuyển theo điểm thi THPT và NV3 là nguyện vọng bạn đã trúng tuyển sớm. Nếu bạn đã đậu bằng điểm thi THPT ở NV1 hoặc NV2 thì các NV trúng tuyển sớm sẽ bị loại. Trường hợp bạn ko trúng tuyển N… Xem thêm', 'hên xui ấy bà ơi, lấy hết nv1 nv2 của ngta rùii mới tới nv3 của bà, còn chỉ tiêu thì may ra dc nhận']"
mn cho em hỏi em đậu DUE ngành qtkd rồi nhưng bên udn em k đậu qtkd thì có trúng tuyển rồi không ạ,22 Tháng 6,18,0,0,0,0,0,0,0,"['mn cho em hỏi em đậu DUE ngành qtkd rồi nhưng bên udn em k đậu qtkd thì có trúng tuyển rồi không ạ', 'Cho mình xin link bên cái cậu đậu vs ạ', '2 pt khác nhau mà em, em đậu pt2 là em đậu QTKD r đó']"
"Cho em hỏi mìn đậu xts thì có bắt buộc phải để trường lên nv1 ko 
Nếu em đặt trường khác lên nv1, due nv2 nhưng nếu nv1 của em k đậu thì nv2 là due có được xét tiếp ko ạ",22 Tháng 6,1,0,0,0,0,0,0,0,"['Cho em hỏi mìn đậu xts thì có bắt buộc phải để trường lên nv1 ko \nNếu em đặt trường khác lên nv1, due nv2 nhưng nếu nv1 của em k đậu thì nv2 là due có được xét tiếp ko ạ', 'Được em nhé']"
Cho em hỏi điểm ưu tiên là cộng theo quy chế mới của BGD hay cộng nguyên điểm v,22 Tháng 6,1,0,0,0,0,0,0,0,"['Cho em hỏi điểm ưu tiên là cộng theo quy chế mới của BGD hay cộng nguyên điểm v', 'Cộng theo quy chế của Bộ GD e nha']"
"Mn ơi cho e hỏi với
- E có đki bên đề án riêng 3 nghành mà e đậu xét tuyển tc-nh nghĩa là 2 nguyên vọng còn lại của e rớt ạ?
- Nếu e để nv1 là hà nội, nv2 là nghành e trúng tuyển (tc-nh đà nẵng) thì có đc không ạ? với lại khi e rớt nv1 thì nv2 của e đc chấp nhận không ạ?",22 Tháng 6,1,0,0,0,0,0,0,0,"['Mn ơi cho e hỏi với\n- E có đki bên đề án riêng 3 nghành mà e đậu xét tuyển tc-nh nghĩa là 2 nguyên vọng còn lại của e rớt ạ?\n- Nếu e để nv1 là hà nội, nv2 là nghành e trúng tuyển (tc-nh đà nẵng) thì có đc không ạ? với lại khi e rớt nv1 thì nv2 của e đc chấp nhận không ạ?', '- đúng rồi e, 2 nguyện vọng còn lại không xét\n- được em nhé']"
Cho e hỏi chỉ tiêu xét pt2 là chừng đoa xong xét từ trên xuống từng nhóm hay mỗi nhóm lại còn có chỉ tiêu nhất định nữa ạ??,18 Tháng 6,18,0,0,0,0,0,0,0,"['Cho e hỏi chỉ tiêu xét pt2 là chừng đoa xong xét từ trên xuống từng nhóm hay mỗi nhóm lại còn có chỉ tiêu nhất định nữa ạ??', 'Điểm quy đổi được xếp từ cao xuống thấp rồi lấy đến khi đủ chỉ tiêu các ngành đó e', 'Dạ cho em hỏi ngày nào có kết quả xét tuyển ạ Nguyễn Thảo Nguyên']"
